<?xml version="1.0" encoding="UTF-8"?>
<config xmlns:xsi="http://www.w3.org/2001/XMLSchema-instance" xsi:noNamespaceSchemaLocation="config.xsd">
    <globalParameters>
        <parameter key="consumerKey" value="1852823608"/>
        <parameter key="consumerSecret" value="f7623417c5fbe029dd366e4e01e34e48"/>
        <Accounts>
            <account id="A">
                <uid>1803876591</uid>
                <screenName>LoopA</screenName>
                <name>loopa@sina.cn</name>
                <password>123456</password>
                <oauth_token>07ab6a78fcc18a624a472a1bc7c274e7</oauth_token>
                <oauth_secret>a66c4cc49a652d2c981bbda82bd9a746</oauth_secret>
            </account>
            <account id="B">
                <uid>1803880061</uid>
                <screenName>LoopB</screenName>
                <name>loopb@sina.cn</name>
                <password>123456</password>
                <oauth_token>76eee405d795677482af833a118c7664</oauth_token>
                <oauth_secret>309d81204c4f94ed1710461cdd329229</oauth_secret>
            </account>
            <account id="C">
                <uid>1803888563</uid>
                <screenName>LoopC</screenName>
                <name>loopc@sina.cn</name>
                <password>123456</password>
                <oauth_token>4698b31925b713c25052f508d22ceeb2</oauth_token>
                <oauth_secret>e9692337cef02a775e05aed4f3a3471f</oauth_secret>
            </account>
            <account id="D">
                <uid>1803882341</uid>
                <screenName>LoopD</screenName>
                <name>loopd@sina.cn</name>
                <password>123456</password>
                <oauth_token>aa1ae9d4f2a23a3c44c137ca8586cfa3</oauth_token>
                <oauth_secret>4e6cded8fef0fb492715e429bec39292</oauth_secret>
            </account>
      
        </Accounts>
    </globalParameters>
    <testCases>
  	
        <baseUrl>http://api.t.sina.com.cn</baseUrl>
	
        <testCase format="XML" id="1" priority="H">
            <description>测试微博的发表、删除</description>
            <request requestClass="com.sina.weibo.looptest.request.CommonLoopRequest" block_on_error="true">
                <reqdesc>发表一篇微博</reqdesc>
                <url>statuses/update</url>
                <method>POST</method>
                <authtype>BASIC</authtype>
                <accountref>A</accountref>
                <enctype>APPLICATION</enctype>
                <parameters>
                    <parameter key="status" value="${random:string(5)}"/>
                </parameters>
                <valuesKeeping>
                    <expression sessionKey="status_0" path="status/text/text()"></expression>
                    <expression sessionKey="status_id_0" path="status/id/text()"></expression>
                </valuesKeeping>
                <assertConditions>
                    <condition>
                        <path type="S" value="status/text/text()"/>
                        <relation>eq</relation>
                        <expectedValue>${reqParam:status}</expectedValue>
                        <errorMsg>返回的微博文本与发表的微博文本不一致</errorMsg>
                    </condition>
                </assertConditions>
            </request>
      
            <request requestClass="com.sina.weibo.looptest.request.CommonLoopRequest" delayedTime="180000">
                <reqdesc>根据ID验证微博</reqdesc>
                <url>statuses/show/${session:status_id_0}</url>
                <method>GET</method>
                <authtype>BASIC</authtype>
                <accountref>A</accountref>
                <enctype>APPLICATION</enctype>
                <parameters/>
                <valuesKeeping/>
                <assertConditions>
                    <condition>
                        <path type="S" value="status/text/text()"/>
                        <relation>eq</relation>
                        <expectedValue>${session:status_0}</expectedValue>
                        <errorMsg>根据ID查到的微博文本和发表的微博文本不一致</errorMsg>
                    </condition>
                    <condition>
                        <path type="S" value="status/id/text()"/>
                        <relation>eq</relation>
                        <expectedValue>${session:status_id_0}</expectedValue>
                        <errorMsg>根据ID查到的微博ID和发表的微博ID不一致</errorMsg>
                    </condition>
                </assertConditions>
            </request>

            <request requestClass="com.sina.weibo.looptest.request.CommonLoopRequest">
                <reqdesc>判断当前用户发表的微博列表中是否已存在刚发布的微博</reqdesc>
                <url>statuses/user_timeline</url>
                <method>GET</method>
                <authtype>BASIC</authtype>
                <accountref>A</accountref>
                <enctype>APPLICATION</enctype>
                <parameters/>
                <valuesKeeping/>
                <assertConditions>
                    <condition>
                        <path type="M" value="statuses/status/text/text()"/>
                        <relation>contains</relation>
                        <expectedValue>${session:status_0}</expectedValue>
                        <errorMsg>当前用户的微博列表中找不到刚发布的微博文本</errorMsg>
                    </condition>
                    <condition>
                        <path type="M" value="statuses/status/id/text()"/>
                        <relation>contains</relation>
                        <expectedValue>${session:status_id_0}</expectedValue>
                        <errorMsg>当前用户的微博列表中找不到刚发布的微博ID</errorMsg>
                    </condition>
                </assertConditions>
            </request>

            <request requestClass="com.sina.weibo.looptest.request.CommonLoopRequest" block_on_error="true">
                <reqdesc>根据ID删除微博</reqdesc>
                <url>statuses/destroy/${session:status_id_0}</url>
                <method>DELETE</method>
                <authtype>BASIC</authtype>
                <accountref>A</accountref>
                <enctype>APPLICATION</enctype>
                <parameters/>
                <valuesKeeping/>
                <assertConditions>
                    <condition>
                        <path type="S" value="status/text/text()"/>
                        <relation>eq</relation>
                        <expectedValue>${session:status_0}</expectedValue>
                        <errorMsg>返回的微博文本与被删除的微博文本不一致</errorMsg>
                    </condition>
                    <condition>
                        <path type="S" value="status/id/text()"/>
                        <relation>eq</relation>
                        <expectedValue>${session:status_id_0}</expectedValue>
                        <errorMsg>返回的微博ID与被删除的微博ID不一致</errorMsg>
                    </condition>
                </assertConditions>
            </request>

            <request requestClass="com.sina.weibo.looptest.request.CommonLoopRequest"  delayedTime="180000">
                <reqdesc>根据ID查找微博</reqdesc>
                <url>statuses/show/${session:status_id_0}</url>
                <method>GET</method>
                <authtype>BASIC</authtype>
                <accountref>A</accountref>
                <enctype>APPLICATION</enctype>
                <parameters/>
                <valuesKeeping/>
                <assertConditions>
                    <condition>
                        <path type="S" value="hash/error_code/text()"></path>
                        <relation>eq</relation>
                        <expectedValue>400</expectedValue>
                        <errorMsg>删除微博后根据ID查找被删除微博状态码不为400</errorMsg>
                    </condition>
                    <condition>
                        <path type="S" value="hash/error/text()"></path>
                        <relation>contains</relation>
                        <expectedValue>target weibo does not exist</expectedValue>
                        <errorMsg>根据ID查找被删除微博没有提示目标微博不存在的信息</errorMsg>
                    </condition>
                </assertConditions>
            </request>

            <request requestClass="com.sina.weibo.looptest.request.CommonLoopRequest">
                <reqdesc>判断当前用户发表的微博列表中是否还存在刚发布的微博</reqdesc>
                <url>statuses/user_timeline</url>
                <method>GET</method>
                <authtype>BASIC</authtype>
                <accountref>A</accountref>
                <enctype>APPLICATION</enctype>
                <parameters/>
                <valuesKeeping/>
                <assertConditions>
                    <condition>
                        <path type="M" value="statuses/status/text/text()"/>
                        <relation>ncontains</relation>
                        <expectedValue>${session:status_0}</expectedValue>
                        <errorMsg>被删除的微博文本仍然出现在当前用户的微博列表内</errorMsg>
                    </condition>
                    <condition>
                        <path type="M" value="statuses/status/id/text()"/>
                        <relation>ncontains</relation>
                        <expectedValue>${session:status_id_0}</expectedValue>
                        <errorMsg>被删除的微博ID仍然出现在当前用户的微博列表内</errorMsg>
                    </condition>
                </assertConditions>
            </request>
      
        </testCase>
	
        <testCase format="JSON" id="2" priority="H">
            <description>测试微博的发表、删除</description>
            <request requestClass="com.sina.weibo.looptest.request.CommonLoopRequest"  block_on_error="true">
                <reqdesc>发表一篇微博</reqdesc>
                <url>statuses/update</url>
                <method>POST</method>
                <authtype>BASIC</authtype>
                <accountref>A</accountref>
                <enctype>APPLICATION</enctype>
                <parameters>